{"$schema":"https://json-schema.org/draft/2020-12/schema","$id":"https://steadyeddiesc.example/schemas/drowned-harbor-alpha2-graybox-route-contract-v1.json","title":"Drowned Harbor Alpha.2 Graybox Route Contract v1","description":"Closed planning-only P0.22 route contract. Not a runtime input.","type":"object","additionalProperties":false,"required":["contract_kind","schema_version","release","authorization","identities","route","stages","transitions","systems","persistence","privacy","safe_routes","traceability","implementation_issue","evidence"],"$defs":{"stage":{"type":"object","additionalProperties":false,"required":["stage_id","stage_version","authority_owner","allowed_intents","reducer_outputs","event_output","save_boundaries","rejection_policy","interruption_policy","maximum_accepted_actions"],"properties":{"stage_id":{"type":"string","pattern":"^[a-z][a-z0-9_]*$"},"stage_version":{"type":"integer","const":1},"authority_owner":{"type":"string","enum":["rules_session","role_session","session_coordinator"]},"allowed_intents":{"type":"array","minItems":1,"uniqueItems":true,"items":{"type":"string","pattern":"^[a-z][a-z0-9_]*$"}},"reducer_outputs":{"type":"array","minItems":2,"uniqueItems":true,"items":{"type":"string","pattern":"^[a-z][a-z0-9_]*$"}},"event_output":{"type":"string","pattern":"^[a-z][a-z0-9_]*$"},"save_boundaries":{"type":"array","minItems":3,"uniqueItems":true,"items":{"type":"string","pattern":"^[a-z][a-z0-9_]*$"}},"rejection_policy":{"type":"string","const":"state_and_rng_noop"},"interruption_policy":{"type":"string","const":"restore_exact_checkpoint_or_fail_closed"},"maximum_accepted_actions":{"type":"integer","minimum":1,"maximum":24}}},"transition":{"type":"object","additionalProperties":false,"required":["transition_id","from_stage","to_stage","authority_owner","condition","exactly_once_identity","save_checkpoint","maximum_attempts"],"properties":{"transition_id":{"type":"string","pattern":"^[a-z][a-z0-9_]*$"},"from_stage":{"type":"string","pattern":"^[a-z][a-z0-9_]*$"},"to_stage":{"type":"string","pattern":"^[a-z][a-z0-9_]*$"},"authority_owner":{"type":"string","enum":["rules_session","session_coordinator"]},"condition":{"type":"string","const":"source_complete_and_target_preconditions_valid"},"exactly_once_identity":{"type":["string","null"]},"save_checkpoint":{"type":"string","pattern":"^[a-z][a-z0-9_]*$"},"maximum_attempts":{"type":"integer","minimum":1,"maximum":3}}}},"properties":{"contract_kind":{"type":"string","const":"drowned_harbor_alpha2_graybox_route_contract"},"schema_version":{"type":"integer","const":1},"release":{"type":"object","additionalProperties":false,"required":["release_id","issue","baseline","branch","state"],"properties":{"release_id":{"const":"P0.22"},"issue":{"const":102},"baseline":{"const":"85b77d5216472afdb4abb7598917d5052eed180a"},"branch":{"const":"docs/p0.22-alpha2-graybox-contract"},"state":{"const":"active_planning"}}},"authorization":{"type":"object","additionalProperties":false,"required":["planning_only","runtime_implementation","alpha2_issue_created","alpha2_activation_authorized","normal_library_visibility","ordinary_export_inclusion","human_evidence_claimed"],"properties":{"planning_only":{"const":true},"runtime_implementation":{"const":false},"alpha2_issue_created":{"const":false},"alpha2_activation_authorized":{"const":false},"normal_library_visibility":{"const":false},"ordinary_export_inclusion":{"const":false},"human_evidence_claimed":{"const":false}}},"identities":{"type":"object","additionalProperties":false,"required":["tale_id","provider_id","package_kind","package_schema_version","target_package_version","target_scenario_version","target_snapshot_version"],"properties":{"tale_id":{"const":"drowned_harbor"},"provider_id":{"const":"drowned_harbor_authorities_v1"},"package_kind":{"const":"tale"},"package_schema_version":{"const":1},"target_package_version":{"const":2},"target_scenario_version":{"const":2},"target_snapshot_version":{"const":2}}},"route":{"type":"object","additionalProperties":false,"required":["entry_stage","terminal_stage","stage_order","transition_order","linear","bounded","terminal_cleanup_required"],"properties":{"entry_stage":{"const":"low_tide_arrival_v1"},"terminal_stage":{"const":"rematch_title_cleanup_v1"},"stage_order":{"type":"array","minItems":8,"maxItems":8,"uniqueItems":true,"items":{"type":"string","pattern":"^[a-z][a-z0-9_]*$"}},"transition_order":{"type":"array","minItems":7,"maxItems":7,"uniqueItems":true,"items":{"type":"string","pattern":"^[a-z][a-z0-9_]*$"}},"linear":{"const":true},"bounded":{"const":true},"terminal_cleanup_required":{"const":true}}},"stages":{"type":"array","minItems":8,"maxItems":8,"items":{"$ref":"#/$defs/stage"}},"transitions":{"type":"array","minItems":7,"maxItems":7,"items":{"$ref":"#/$defs/transition"}},"systems":{"type":"object","additionalProperties":false,"required":["movement_owner","stage_and_decision_owner","private_attribution_owner","cleanup_owner","council_identity","high_water_identity","deadlock_policy","rng_streams"],"properties":{"movement_owner":{"const":"board_state"},"stage_and_decision_owner":{"const":"rules_session"},"private_attribution_owner":{"const":"role_session"},"cleanup_owner":{"const":"session_coordinator"},"council_identity":{"const":"council_commitment_id"},"high_water_identity":{"const":"high_water_transformation_id"},"deadlock_policy":{"const":"bounded_progress_watchdog_with_actionable_diagnostic"},"rng_streams":{"type":"array","minItems":4,"maxItems":4,"uniqueItems":true,"items":{"type":"string","pattern":"^[a-z][a-z0-9_]*$"}}}},"persistence":{"type":"object","additionalProperties":false,"required":["identity_selection","migration_policy","checkpoints","processed_request_and_event_ids_persisted","replay_policy","rollback_policy","rematch_policy","title_cleanup_policy"],"properties":{"identity_selection":{"const":"validate_tale_package_provider_and_snapshot_before_state"},"migration_policy":{"const":"explicit_alpha1_snapshot_v1_to_alpha2_snapshot_v2_or_fail_closed"},"checkpoints":{"type":"array","minItems":8,"maxItems":8,"uniqueItems":true,"items":{"type":"string","pattern":"^[a-z][a-z0-9_]*$"}},"processed_request_and_event_ids_persisted":{"const":true},"replay_policy":{"const":"equal_authoritative_inputs_seeds_and_snapshot_produce_equivalent_outcome"},"rollback_policy":{"const":"reject_without_partial_authority_and_preserve_prior_snapshot"},"rematch_policy":{"const":"rebuild_through_validated_package_and_scoped_provider"},"title_cleanup_policy":{"const":"clear_all_drowned_harbor_authority_before_return"}}},"privacy":{"type":"object","additionalProperties":false,"required":["classes","shared_output_policy","director_input_allowlist","private_projection_owner","director_private_access"],"properties":{"classes":{"type":"array","minItems":4,"maxItems":4,"uniqueItems":true,"items":{"type":"string","enum":["public","controlled_reveal_private","seat_private","faction_private"]}},"shared_output_policy":{"const":"public_projection_only_without_private_terms_or_desirability_hints"},"director_input_allowlist":{"type":"array","minItems":6,"maxItems":6,"uniqueItems":true,"items":{"type":"string","pattern":"^[a-z][a-z0-9_]*$"}},"private_projection_owner":{"const":"role_session"},"director_private_access":{"const":false}}},"safe_routes":{"type":"object","additionalProperties":false,"required":["supported_seat_counts","route_kind","stage_order","action_owner_policy","disconnect_policy","maximum_accepted_actions","maximum_rejections_before_diagnostic","deadlock_free_required"],"properties":{"supported_seat_counts":{"type":"array","minItems":8,"maxItems":8,"uniqueItems":true,"items":{"type":"integer","minimum":1,"maximum":8}},"route_kind":{"const":"cooperative_public_safe_route"},"stage_order":{"type":"array","minItems":8,"maxItems":8,"items":{"type":"string","pattern":"^[a-z][a-z0-9_]*$"}},"action_owner_policy":{"const":"lowest_connected_eligible_stable_seat_then_next"},"disconnect_policy":{"const":"surrogate_control_preserves_stable_seat_state"},"maximum_accepted_actions":{"type":"integer","maximum":96},"maximum_rejections_before_diagnostic":{"type":"integer","maximum":8},"deadlock_free_required":{"const":true}}},"traceability":{"type":"object","additionalProperties":false,"required":["runtime_may_load_authoring_references","runtime_may_load_prototype_fixtures","authoring_reference_path","prototype_fixture_path","future_outputs","source_ledger_policy"],"properties":{"runtime_may_load_authoring_references":{"const":false},"runtime_may_load_prototype_fixtures":{"const":false},"authoring_reference_path":{"const":"docs/tales/drowned_harbor/authoring/drowned_harbor_authoring_reference_v1.json"},"prototype_fixture_path":{"const":"game/tests/drowned_harbor_dev_only/"},"future_outputs":{"type":"array","minItems":5,"maxItems":5,"uniqueItems":true,"items":{"type":"string","minLength":8}},"source_ledger_policy":{"const":"every_runtime_output_maps_to_reviewed_repository_authority"}}},"implementation_issue":{"type":"object","additionalProperties":false,"required":["release_id","title","state","github_issue","branch","draft_pr_title","codex_expected","recommended_codex_effort","activation_authorized","issue_definition_path"],"properties":{"release_id":{"const":"v0.2.0-alpha.2"},"title":{"const":"Drowned Harbor End-to-End Graybox"},"state":{"const":"planned_blocked"},"github_issue":{"type":"null"},"branch":{"const":"feature/v0.2.0-alpha.2-end-to-end-graybox"},"draft_pr_title":{"const":"v0.2.0-alpha.2 — Drowned Harbor End-to-End Graybox"},"codex_expected":{"const":true},"recommended_codex_effort":{"const":"very_high"},"activation_authorized":{"const":false},"issue_definition_path":{"const":"docs/preproduction/P0.22_Alpha2_Implementation_Issue.md"}}},"evidence":{"type":"object","additionalProperties":false,"required":["automation_is_human_evidence","physical_controller_validated","television_readability_validated","accessibility_certified","privacy_or_security_certified","fun_or_balance_validated","production_ready","public_release_authorized"],"properties":{"automation_is_human_evidence":{"const":false},"physical_controller_validated":{"const":false},"television_readability_validated":{"const":false},"accessibility_certified":{"const":false},"privacy_or_security_certified":{"const":false},"fun_or_balance_validated":{"const":false},"production_ready":{"const":false},"public_release_authorized":{"const":false}}}}}
