{"contract_kind":"drowned_harbor_alpha2_graybox_route_contract","schema_version":1,"release":{"release_id":"P0.22","issue":102,"baseline":"85b77d5216472afdb4abb7598917d5052eed180a","branch":"docs/p0.22-alpha2-graybox-contract","state":"active_planning"},"authorization":{"planning_only":true,"runtime_implementation":false,"alpha2_issue_created":false,"alpha2_activation_authorized":false,"normal_library_visibility":false,"ordinary_export_inclusion":false,"human_evidence_claimed":false},"identities":{"tale_id":"drowned_harbor","provider_id":"drowned_harbor_authorities_v1","package_kind":"tale","package_schema_version":1,"target_package_version":2,"target_scenario_version":2,"target_snapshot_version":2},"route":{"entry_stage":"low_tide_arrival_v1","terminal_stage":"rematch_title_cleanup_v1","stage_order":["low_tide_arrival_v1","bellhouse_ledger_v1","lighthouse_council_v1","high_water_v1","last_light_v1","ending_resolution_v1","epilogue_attribution_v1","rematch_title_cleanup_v1"],"transition_order":["transition_low_tide_to_bellhouse","transition_bellhouse_to_council","transition_council_to_high_water","transition_high_water_to_last_light","transition_last_light_to_ending","transition_ending_to_epilogue","transition_epilogue_to_cleanup"],"linear":true,"bounded":true,"terminal_cleanup_required":true},"stages":[{"stage_id":"low_tide_arrival_v1","stage_version":1,"authority_owner":"rules_session","allowed_intents":["move_to_landmark","confirm_low_tide_arrival"],"reducer_outputs":["pawn_positions","visited_landmarks","arrival_complete"],"event_output":"low_tide_arrival_completed","save_boundaries":["stage_entry","after_each_accepted_movement","stage_complete"],"rejection_policy":"state_and_rng_noop","interruption_policy":"restore_exact_checkpoint_or_fail_closed","maximum_accepted_actions":24},{"stage_id":"bellhouse_ledger_v1","stage_version":1,"authority_owner":"rules_session","allowed_intents":["inspect_ledger","commit_bellhouse_choice","recover_bellhouse_choice"],"reducer_outputs":["ledger_inspected","bellhouse_choice","recovery_state"],"event_output":"bellhouse_choice_committed","save_boundaries":["stage_entry","after_ledger_inspection","after_choice_commit","stage_complete"],"rejection_policy":"state_and_rng_noop","interruption_policy":"restore_exact_checkpoint_or_fail_closed","maximum_accepted_actions":12},{"stage_id":"lighthouse_council_v1","stage_version":1,"authority_owner":"rules_session","allowed_intents":["submit_council_commitment","resolve_council_commitment"],"reducer_outputs":["seat_commitments","council_result","council_commitment_id"],"event_output":"council_resolved","save_boundaries":["stage_entry","after_each_commitment","after_council_resolution","stage_complete"],"rejection_policy":"state_and_rng_noop","interruption_policy":"restore_exact_checkpoint_or_fail_closed","maximum_accepted_actions":18},{"stage_id":"high_water_v1","stage_version":1,"authority_owner":"rules_session","allowed_intents":["acknowledge_high_water","apply_high_water_transformation"],"reducer_outputs":["tide_state","connector_mutations","transformed_forms","high_water_transformation_id"],"event_output":"high_water_transformation_applied","save_boundaries":["stage_entry","before_transformation","after_transformation","stage_complete"],"rejection_policy":"state_and_rng_noop","interruption_policy":"restore_exact_checkpoint_or_fail_closed","maximum_accepted_actions":8},{"stage_id":"last_light_v1","stage_version":1,"authority_owner":"rules_session","allowed_intents":["move_to_last_light_route","commit_last_light_action","resolve_last_light"],"reducer_outputs":["last_light_positions","last_light_commitments","last_light_result"],"event_output":"last_light_resolved","save_boundaries":["stage_entry","after_each_accepted_movement","after_each_commitment","stage_complete"],"rejection_policy":"state_and_rng_noop","interruption_policy":"restore_exact_checkpoint_or_fail_closed","maximum_accepted_actions":24},{"stage_id":"ending_resolution_v1","stage_version":1,"authority_owner":"rules_session","allowed_intents":["resolve_ending"],"reducer_outputs":["ending_id","ending_result","public_consequences"],"event_output":"ending_resolved","save_boundaries":["stage_entry","after_ending_resolution","stage_complete"],"rejection_policy":"state_and_rng_noop","interruption_policy":"restore_exact_checkpoint_or_fail_closed","maximum_accepted_actions":2},{"stage_id":"epilogue_attribution_v1","stage_version":1,"authority_owner":"role_session","allowed_intents":["resolve_epilogue_attribution","acknowledge_epilogue"],"reducer_outputs":["seat_attributions","public_epilogue","epilogue_acknowledged"],"event_output":"epilogue_acknowledged","save_boundaries":["stage_entry","after_attribution_resolution","after_epilogue_acknowledgement","stage_complete"],"rejection_policy":"state_and_rng_noop","interruption_policy":"restore_exact_checkpoint_or_fail_closed","maximum_accepted_actions":10},{"stage_id":"rematch_title_cleanup_v1","stage_version":1,"authority_owner":"session_coordinator","allowed_intents":["request_rematch","return_to_title"],"reducer_outputs":["cleanup_complete","next_destination"],"event_output":"drowned_harbor_session_cleared","save_boundaries":["stage_entry","before_cleanup","after_cleanup_terminal"],"rejection_policy":"state_and_rng_noop","interruption_policy":"restore_exact_checkpoint_or_fail_closed","maximum_accepted_actions":2}],"transitions":[{"transition_id":"transition_low_tide_to_bellhouse","from_stage":"low_tide_arrival_v1","to_stage":"bellhouse_ledger_v1","authority_owner":"rules_session","condition":"source_complete_and_target_preconditions_valid","exactly_once_identity":null,"save_checkpoint":"after_transition_low_tide_to_bellhouse","maximum_attempts":3},{"transition_id":"transition_bellhouse_to_council","from_stage":"bellhouse_ledger_v1","to_stage":"lighthouse_council_v1","authority_owner":"rules_session","condition":"source_complete_and_target_preconditions_valid","exactly_once_identity":null,"save_checkpoint":"after_transition_bellhouse_to_council","maximum_attempts":3},{"transition_id":"transition_council_to_high_water","from_stage":"lighthouse_council_v1","to_stage":"high_water_v1","authority_owner":"rules_session","condition":"source_complete_and_target_preconditions_valid","exactly_once_identity":"council_commitment_id","save_checkpoint":"after_transition_council_to_high_water","maximum_attempts":3},{"transition_id":"transition_high_water_to_last_light","from_stage":"high_water_v1","to_stage":"last_light_v1","authority_owner":"rules_session","condition":"source_complete_and_target_preconditions_valid","exactly_once_identity":"high_water_transformation_id","save_checkpoint":"after_transition_high_water_to_last_light","maximum_attempts":3},{"transition_id":"transition_last_light_to_ending","from_stage":"last_light_v1","to_stage":"ending_resolution_v1","authority_owner":"rules_session","condition":"source_complete_and_target_preconditions_valid","exactly_once_identity":null,"save_checkpoint":"after_transition_last_light_to_ending","maximum_attempts":3},{"transition_id":"transition_ending_to_epilogue","from_stage":"ending_resolution_v1","to_stage":"epilogue_attribution_v1","authority_owner":"rules_session","condition":"source_complete_and_target_preconditions_valid","exactly_once_identity":null,"save_checkpoint":"after_transition_ending_to_epilogue","maximum_attempts":3},{"transition_id":"transition_epilogue_to_cleanup","from_stage":"epilogue_attribution_v1","to_stage":"rematch_title_cleanup_v1","authority_owner":"session_coordinator","condition":"source_complete_and_target_preconditions_valid","exactly_once_identity":null,"save_checkpoint":"after_transition_epilogue_to_cleanup","maximum_attempts":3}],"systems":{"movement_owner":"board_state","stage_and_decision_owner":"rules_session","private_attribution_owner":"role_session","cleanup_owner":"session_coordinator","council_identity":"council_commitment_id","high_water_identity":"high_water_transformation_id","deadlock_policy":"bounded_progress_watchdog_with_actionable_diagnostic","rng_streams":["drowned_harbor_route_authority","drowned_harbor_board_authority","drowned_harbor_social_authority","drowned_harbor_director_authority"]},"persistence":{"identity_selection":"validate_tale_package_provider_and_snapshot_before_state","migration_policy":"explicit_alpha1_snapshot_v1_to_alpha2_snapshot_v2_or_fail_closed","checkpoints":["low_tide_arrival_v1","bellhouse_ledger_v1","lighthouse_council_v1","high_water_v1","last_light_v1","ending_resolution_v1","epilogue_attribution_v1","rematch_title_cleanup_v1"],"processed_request_and_event_ids_persisted":true,"replay_policy":"equal_authoritative_inputs_seeds_and_snapshot_produce_equivalent_outcome","rollback_policy":"reject_without_partial_authority_and_preserve_prior_snapshot","rematch_policy":"rebuild_through_validated_package_and_scoped_provider","title_cleanup_policy":"clear_all_drowned_harbor_authority_before_return"},"privacy":{"classes":["public","controlled_reveal_private","seat_private","faction_private"],"shared_output_policy":"public_projection_only_without_private_terms_or_desirability_hints","director_input_allowlist":["authoritative_revision","connected_seat_count","stage_id","public_progress","public_pressure","public_recovery_count"],"private_projection_owner":"role_session","director_private_access":false},"safe_routes":{"supported_seat_counts":[1,2,3,4,5,6,7,8],"route_kind":"cooperative_public_safe_route","stage_order":["low_tide_arrival_v1","bellhouse_ledger_v1","lighthouse_council_v1","high_water_v1","last_light_v1","ending_resolution_v1","epilogue_attribution_v1","rematch_title_cleanup_v1"],"action_owner_policy":"lowest_connected_eligible_stable_seat_then_next","disconnect_policy":"surrogate_control_preserves_stable_seat_state","maximum_accepted_actions":96,"maximum_rejections_before_diagnostic":8,"deadlock_free_required":true},"traceability":{"runtime_may_load_authoring_references":false,"runtime_may_load_prototype_fixtures":false,"